<?xml version="1.0" encoding="UTF-8"?><JobDescription xmlns:xsi="http://www.w3.org/2001/XMLSchema-instance" xsi:noNamespaceSchemaLocation="C:\Documents and Settings\Joseph\My Documents\Computing yr4\Masters Project\xml\jobDescription.xsd">	<db>		<dbName>hospital</dbName>		<dbContents>			<dbTablename>patient</dbTablename>			<dbTableFields>				<dbFieldName>patientName</dbFieldName>				<presentationName>Patient Name</presentationName>			</dbTableFields>		</dbContents>		<dbContents>			<dbTablename>patient</dbTablename>			<dbTableFields>				<dbFieldName>age</dbFieldName>				<presentationName>Patient Age</presentationName>				<dbFieldName>ward</dbFieldName>				<presentationName>Ward</presentationName>			</dbTableFields>		</dbContents>		<dbContents>			<dbTablename>perscriptions</dbTablename>			<dbTableFields>				<dbFieldName>drugs</dbFieldName>				<presentationName>Patient drugs</presentationName>			</dbTableFields>		</dbContents>		<dbContents>			<dbTablename>pharmacy</dbTablename>			<dbTableFields>				<dbFieldName>correction</dbFieldName>				<presentationName>Correction</presentationName>			</dbTableFields>		</dbContents>		<dbContents>			<dbTablename>pharmacytimetable</dbTablename>			<dbTableFields>				<dbFieldName>pharmacyCollection</dbFieldName>				<presentationName>Drugs Ready</presentationName>			</dbTableFields>		</dbContents>		<dbContents>			<dbTablename>controlledDrugs</dbTablename>			<dbTableFields>				<dbFieldName>controlledDrugs</dbFieldName>				<presentationName>Controlled Drugs Approved</presentationName>			</dbTableFields>		</dbContents>		</db></JobDescription>