<?xml version="1.0" encoding="UTF-8"?><JobDescription xmlns:xsi="http://www.w3.org/2001/XMLSchema-instance" xsi:noNamespaceSchemaLocation="C:\Documents and Settings\Joseph\My Documents\Computing yr4\Masters Project\xml\jobDescription.xsd">	<db>		<dbName>iWFMS</dbName>		<dbContents>			<dbTablename>text1</dbTablename>			<dbTableFields>				<dbFieldName>text1</dbFieldName>				<presentationName>Data Text 1</presentationName>			</dbTableFields>		</dbContents>		<dbContents>			<dbTablename>text2</dbTablename>			<dbTableFields>				<dbFieldName>text2</dbFieldName>				<presentationName>Data Text 2</presentationName>			</dbTableFields>		</dbContents>		</db></JobDescription>